{
  "extensions": {
    "aws": {
      "traffic_type": "ALL",
      "log_format": "default"
    }
  },
  "urn": "urn:mcnet:v1:aws:account_id=123456789012,region=us-east-1:observability-reference:fl-0123456789abcdef0",
  "native_id": "fl-0123456789abcdef0",
  "resource_type": "observability-reference",
  "provider": "aws",
  "scope": {
    "provider": "aws",
    "tenant_id": null,
    "account_id": "123456789012",
    "subscription_id": null,
    "project_id": null,
    "resource_group": null,
    "region": "us-east-1",
    "location": null,
    "zone": null,
    "collected_at": "2026-08-28T12:00:00Z"
  },
  "name": null,
  "tags": {},
  "observed_at": "2026-08-28T12:00:00Z",
  "source_api": "ec2:DescribeFlowLogs",
  "collection_completeness": "complete",
  "observability_type": "flow-log",
  "target_resource_urn": "urn:mcnet:v1:aws:account_id=123456789012,region=us-east-1:network:vpc-0abc123def456789",
  "enabled": true,
  "destination": "arn:aws:logs:us-east-1:123456789012:log-group:/vpc/flow-logs/prod-vpc",
  "state": "active"
}
