{
  "extensions": {
    "azure": {
      "retention_days": 30,
      "format_type": "JSON",
      "format_version": 2,
      "traffic_analytics_enabled": true
    }
  },
  "urn": "urn:mcnet:v1:azure:subscription_id=a1b2c3d4-5e6f-4a7b-8c9d-0e1f2a3b4c5d,location=eastus,resource_group=rg-networking:observability-reference:/subscriptions/a1b2c3d4-5e6f-4a7b-8c9d-0e1f2a3b4c5d/resourceGroups/rg-networking/providers/Microsoft.Network/networkWatchers/NetworkWatcher_eastus/flowLogs/fl-nsg-app",
  "native_id": "/subscriptions/a1b2c3d4-5e6f-4a7b-8c9d-0e1f2a3b4c5d/resourceGroups/rg-networking/providers/Microsoft.Network/networkWatchers/NetworkWatcher_eastus/flowLogs/fl-nsg-app",
  "resource_type": "observability-reference",
  "provider": "azure",
  "scope": {
    "provider": "azure",
    "tenant_id": null,
    "account_id": null,
    "subscription_id": "a1b2c3d4-5e6f-4a7b-8c9d-0e1f2a3b4c5d",
    "project_id": null,
    "resource_group": "rg-networking",
    "region": null,
    "location": "eastus",
    "zone": null,
    "collected_at": "2026-08-28T12:00:00Z"
  },
  "name": "fl-nsg-app",
  "tags": {},
  "observed_at": "2026-08-28T12:00:00Z",
  "source_api": "FlowLogsOperations.list",
  "collection_completeness": "complete",
  "observability_type": "flow-log",
  "target_resource_urn": "urn:mcnet:v1:azure:subscription_id=a1b2c3d4-5e6f-4a7b-8c9d-0e1f2a3b4c5d,location=eastus,resource_group=rg-networking:firewall-rule:/subscriptions/a1b2c3d4-5e6f-4a7b-8c9d-0e1f2a3b4c5d/resourceGroups/rg-networking/providers/Microsoft.Network/networkSecurityGroups/nsg-app",
  "enabled": true,
  "destination": "storage-account:stnetworklogseastus",
  "state": "enabled"
}
